====
---- HIVE_QUERY
use $DATABASE;
CREATE TABLE ice_mixed_formats(i int, j int)
STORED BY ICEBERG
STORED AS PARQUET
TBLPROPERTIES ('format-version'='2');
INSERT INTO ice_mixed_formats VALUES (1, 1), (10, 10);
DELETE FROM ice_mixed_formats WHERE i = 1;
ALTER TABLE ice_mixed_formats SET TBLPROPERTIES ('write.format.default'='orc');
INSERT INTO ice_mixed_formats VALUES (2, 2), (3, 3);
DELETE FROM ice_mixed_formats WHERE i = 2;
ALTER TABLE ice_mixed_formats SET TBLPROPERTIES ('write.format.default'='avro');
DELETE FROM ice_mixed_formats WHERE i = 3;
====
---- QUERY
refresh ice_mixed_formats;
====
---- QUERY
SHOW FILES IN ice_mixed_formats;
---- RESULTS: VERIFY_IS_SUBSET
row_regex:'$NAMENODE/test-warehouse/$DATABASE.db/ice_mixed_formats/data/.*-data-.*.parquet','.*B','','.*'
row_regex:'$NAMENODE/test-warehouse/$DATABASE.db/ice_mixed_formats/data/.*-delete-.*parquet','.*B','','.*'
row_regex:'$NAMENODE/test-warehouse/$DATABASE.db/ice_mixed_formats/data/.*-data-.*.orc','.*B','','.*'
row_regex:'$NAMENODE/test-warehouse/$DATABASE.db/ice_mixed_formats/data/.*-delete-.*orc','.*B','','.*'
row_regex:'$NAMENODE/test-warehouse/$DATABASE.db/ice_mixed_formats/data/.*-delete-.*.avro','.*B','','.*'
---- TYPES
STRING, STRING, STRING, STRING
====
---- QUERY
select * from ice_mixed_formats;
---- RESULTS
10,10
---- TYPES
INT,INT
====
---- QUERY
select count(*) from ice_mixed_formats;
---- RESULTS
1
---- TYPES
BIGINT
====
---- QUERY
select * from ice_mixed_formats where i > 1;
---- RESULTS
10,10
---- TYPES
INT,INT
====
---- QUERY
select count(*) from ice_mixed_formats where i > 1;
---- RESULTS
1
---- TYPES
BIGINT
====
---- QUERY
select i, count(*) from ice_mixed_formats group by 1;
---- RESULTS
10,1
---- TYPES
INT,BIGINT
====
---- HIVE_QUERY
use $DATABASE;
CREATE TABLE ice_mixed_formats_partitioned(i int, j int)
PARTITIONED BY SPEC (truncate(2, j))
STORED BY ICEBERG
STORED AS PARQUET
TBLPROPERTIES ('format-version'='2');
INSERT INTO ice_mixed_formats_partitioned VALUES (1, 1), (10, 1);
DELETE FROM ice_mixed_formats_partitioned WHERE i = 1;
ALTER TABLE ice_mixed_formats_partitioned SET TBLPROPERTIES ('write.format.default'='orc');
INSERT INTO ice_mixed_formats_partitioned VALUES (2, 2), (3, 2);
DELETE FROM ice_mixed_formats_partitioned WHERE i = 2;
ALTER TABLE ice_mixed_formats_partitioned SET TBLPROPERTIES ('write.format.default'='avro');
DELETE FROM ice_mixed_formats_partitioned WHERE i = 3;
====
---- QUERY
refresh ice_mixed_formats_partitioned;
====
---- QUERY
SHOW FILES IN ice_mixed_formats_partitioned;
---- RESULTS: VERIFY_IS_SUBSET
row_regex:'$NAMENODE/test-warehouse/$DATABASE.db/ice_mixed_formats_partitioned/data/j_trunc=0/.*-data-.*.parquet','.*B','','.*'
row_regex:'$NAMENODE/test-warehouse/$DATABASE.db/ice_mixed_formats_partitioned/data/j_trunc=0/.*-delete-.*parquet','.*B','','.*'
row_regex:'$NAMENODE/test-warehouse/$DATABASE.db/ice_mixed_formats_partitioned/data/j_trunc=2/.*-data-.*.orc','.*B','','.*'
row_regex:'$NAMENODE/test-warehouse/$DATABASE.db/ice_mixed_formats_partitioned/data/j_trunc=2/.*-delete-.*orc','.*B','','.*'
row_regex:'$NAMENODE/test-warehouse/$DATABASE.db/ice_mixed_formats_partitioned/data/j_trunc=2/.*-delete-.*.avro','.*B','','.*'
---- TYPES
STRING, STRING, STRING, STRING
====
---- QUERY
select * from ice_mixed_formats_partitioned;
---- RESULTS
10,1
---- TYPES
INT,INT
====
---- QUERY
select count(*) from ice_mixed_formats_partitioned;
---- RESULTS
1
---- TYPES
BIGINT
====
---- QUERY
select * from ice_mixed_formats_partitioned where i > 1;
---- RESULTS
10,1
---- TYPES
INT,INT
====
---- QUERY
select count(*) from ice_mixed_formats_partitioned where i > 1;
---- RESULTS
1
---- TYPES
BIGINT
====
---- QUERY
select i, count(*) from ice_mixed_formats_partitioned group by 1;
---- RESULTS
10,1
---- TYPES
INT,BIGINT
====
