====
---- QUERY
# Row-filtering policy keeps rows with "id % 2 = 0"
select * from functional.alltypestiny
---- RESULTS
0,true,0,0,0,0,0,0,'01/01/09','0',2009-01-01 00:00:00,2009,1
2,true,0,0,0,0,0,0,'02/01/09','0',2009-02-01 00:00:00,2009,2
4,true,0,0,0,0,0,0,'03/01/09','0',2009-03-01 00:00:00,2009,3
6,true,0,0,0,0,0,0,'04/01/09','0',2009-04-01 00:00:00,2009,4
---- TYPES
INT,BOOLEAN,TINYINT,SMALLINT,INT,BIGINT,FLOAT,DOUBLE,STRING,STRING,TIMESTAMP,INT,INT
====
---- QUERY
# Test on star select item with other columns
# Row-filtering policy keeps rows with "id % 2 = 0"
select int_col, * from functional.alltypestiny
---- RESULTS
0,0,true,0,0,0,0,0,0,'01/01/09','0',2009-01-01 00:00:00,2009,1
0,2,true,0,0,0,0,0,0,'02/01/09','0',2009-02-01 00:00:00,2009,2
0,4,true,0,0,0,0,0,0,'03/01/09','0',2009-03-01 00:00:00,2009,3
0,6,true,0,0,0,0,0,0,'04/01/09','0',2009-04-01 00:00:00,2009,4
---- TYPES
INT,INT,BOOLEAN,TINYINT,SMALLINT,INT,BIGINT,FLOAT,DOUBLE,STRING,STRING,TIMESTAMP,INT,INT
====
---- QUERY
# Test on star select item with other columns
# Row-filtering policy keeps rows with "id % 2 = 0"
select string_col, * from functional.alltypestiny
---- RESULTS
'0',0,true,0,0,0,0,0,0,'01/01/09','0',2009-01-01 00:00:00,2009,1
'0',2,true,0,0,0,0,0,0,'02/01/09','0',2009-02-01 00:00:00,2009,2
'0',4,true,0,0,0,0,0,0,'03/01/09','0',2009-03-01 00:00:00,2009,3
'0',6,true,0,0,0,0,0,0,'04/01/09','0',2009-04-01 00:00:00,2009,4
---- TYPES
STRING,INT,BOOLEAN,TINYINT,SMALLINT,INT,BIGINT,FLOAT,DOUBLE,STRING,STRING,TIMESTAMP,INT,INT
====
---- QUERY
# Test on star select item with other columns
# Row-filtering policy keeps rows with "id % 2 = 0"
select string_col, *, int_col from functional.alltypestiny
---- RESULTS
'0',0,true,0,0,0,0,0,0,'01/01/09','0',2009-01-01 00:00:00,2009,1,0
'0',2,true,0,0,0,0,0,0,'02/01/09','0',2009-02-01 00:00:00,2009,2,0
'0',4,true,0,0,0,0,0,0,'03/01/09','0',2009-03-01 00:00:00,2009,3,0
'0',6,true,0,0,0,0,0,0,'04/01/09','0',2009-04-01 00:00:00,2009,4,0
---- TYPES
STRING,INT,BOOLEAN,TINYINT,SMALLINT,INT,BIGINT,FLOAT,DOUBLE,STRING,STRING,TIMESTAMP,INT,INT,INT
====
---- QUERY
# Test on star select item with other columns
# Row-filtering policy keeps rows with "id % 2 = 0"
select string_col, *, month, *, int_col from functional.alltypestiny
---- RESULTS
'0',0,true,0,0,0,0,0,0,'01/01/09','0',2009-01-01 00:00:00,2009,1,1,0,true,0,0,0,0,0,0,'01/01/09','0',2009-01-01 00:00:00,2009,1,0
'0',2,true,0,0,0,0,0,0,'02/01/09','0',2009-02-01 00:00:00,2009,2,2,2,true,0,0,0,0,0,0,'02/01/09','0',2009-02-01 00:00:00,2009,2,0
'0',4,true,0,0,0,0,0,0,'03/01/09','0',2009-03-01 00:00:00,2009,3,3,4,true,0,0,0,0,0,0,'03/01/09','0',2009-03-01 00:00:00,2009,3,0
'0',6,true,0,0,0,0,0,0,'04/01/09','0',2009-04-01 00:00:00,2009,4,4,6,true,0,0,0,0,0,0,'04/01/09','0',2009-04-01 00:00:00,2009,4,0
---- TYPES
STRING,INT,BOOLEAN,TINYINT,SMALLINT,INT,BIGINT,FLOAT,DOUBLE,STRING,STRING,TIMESTAMP,INT,INT,INT,INT,BOOLEAN,TINYINT,SMALLINT,INT,BIGINT,FLOAT,DOUBLE,STRING,STRING,TIMESTAMP,INT,INT,INT
====
---- QUERY
# Row-filtering policy keeps rows with
# "(string_col = '0' and id <= 0) or (string_col = '1' and bool_col = true and id > 90)"
select id, string_col, bool_col, year, month from functional.alltypessmall
---- RESULTS
0,'0',true,2009,1
96,'1',true,2009,4
---- TYPES
INT,STRING,BOOLEAN,INT,INT
====
---- QUERY
# Test joins on the above two tables.
select t.id, t.string_col, t.bool_col, t.year, t.month
from functional.alltypestiny t join functional.alltypessmall s using (id)
---- RESULTS
0,'0',true,2009,1
---- TYPES
INT,STRING,BOOLEAN,INT,INT
====
---- QUERY
# Test joins on the above two tables.
select t.id, t.string_col, t.bool_col, t.year, t.month, s.id
from functional.alltypestiny t left join functional.alltypessmall s using (id)
---- RESULTS
0,'0',true,2009,1,0
2,'0',true,2009,2,NULL
4,'0',true,2009,3,NULL
6,'0',true,2009,4,NULL
---- TYPES
INT,STRING,BOOLEAN,INT,INT,INT
====
---- QUERY
# Test joins on the above two tables.
select t.id, s.id, s.string_col, s.bool_col, s.year, s.month
from functional.alltypestiny t right join functional.alltypessmall s using (id)
---- RESULTS
0,0,'0',true,2009,1
NULL,96,'1',true,2009,4
---- TYPES
INT,INT,STRING,BOOLEAN,INT,INT
====
---- QUERY
# Test set operation on the above two tables.
select id, string_col, bool_col, year, month from functional.alltypestiny
intersect
select id, string_col, bool_col, year, month from functional.alltypessmall
---- RESULTS
0,'0',true,2009,1
---- TYPES
INT,STRING,BOOLEAN,INT,INT
====
---- QUERY
# Row-filtering policy keeps rows with "year = 2009 and month = 1". Test on aggregate.
select min(id), max(id), count(*) from functional.alltypes
---- RESULTS
0,309,310
---- TYPES
INT,INT,BIGINT
====
---- QUERY
# Row-filtering policy keeps rows with "year = 2009 and month = 1". Test on aggregate.
select count(distinct id), count(distinct string_col) from functional.alltypes
---- RESULTS
310,10
---- TYPES
BIGINT,BIGINT
====
---- QUERY
# Row-filtering policy keeps rows with "year = 2009 and month = 1". Test on aggregate.
select year, min(month), count(*) from functional.alltypes group by year
---- RESULTS
2009,1,310
---- TYPES
INT,INT,BIGINT
====
---- QUERY
# Test row filter applied on subquery in HAVING clause.
# functional_orc_def.alltypes has no row filters. functional.alltypes has a row filter
# "year = 2009 and month = 1" which results in its row count to be 310.
select year, month, max(id) from functional_orc_def.alltypes
group by year, month
having max(id) < 2 * (select count(*) from functional.alltypes)
---- RESULTS
2009,1,309
2009,2,589
---- TYPES
INT,INT,INT
====
---- QUERY
# Test row filter applied on subquery in SelectList.
# functional.alltypestiny has row filter "id % 2 = 0", so its max(id) is 6.
# functional.alltypes has row filter "year = 2009 and month = 1".
SELECT id, int_col,
  (select max(id) from functional.alltypestiny) as x,
  case
    when id < (select max(id) from functional.alltypestiny) then 0
    else 1
  end as y
from functional.alltypes t2
order by id
limit 10
---- RESULTS
0,0,6,0
1,1,6,0
2,2,6,0
3,3,6,0
4,4,6,0
5,5,6,0
6,6,6,1
7,7,6,1
8,8,6,1
9,9,6,1
---- TYPES
INT,INT,INT,TINYINT
---- LABELS
id,int_col,x,y
====
---- QUERY
# Test row filter applied on subquery in SelectList.
# functional.alltypestiny has row filter "id % 2 = 0", so its max(id) is 6.
# functional.alltypes has row filter "year = 2009 and month = 1".
SELECT id, count(*) over (partition by
  case
    when id > (select max(id) from functional.alltypestiny) then id
    else id + 5
  end) as x
from functional.alltypes t2
order by id
limit 10
---- RESULTS
0,1
1,1
2,2
3,2
4,2
5,2
6,2
7,2
8,2
9,2
---- TYPES
INT,BIGINT
---- LABELS
id,x
====
---- QUERY
# Test on local views. functional.alltypestiny has row filter "id % 2 = 0".
with v as (select id, bool_col, string_col from functional.alltypestiny)
select * from v
---- RESULTS
0,true,'0'
2,true,'0'
4,true,'0'
6,true,'0'
---- TYPES
INT,BOOLEAN,STRING
====
---- QUERY
# Test on local views. Correctly ignore masking on local view names so no row filters are
# applied here.
use functional;
with alltypestiny as (select 1 as id)
select * from alltypestiny
---- RESULTS
1
---- TYPES
TINYINT
---- LABELS
id
====
---- QUERY
# Test on local views. Correctly ignore masking on local view names so row filter of
# functional.alltypessmall won't be applied here, and row filter of alltypestiny is
# correctly applied.
use functional;
with alltypessmall as (select 1 as id)
select alltypessmall.id from alltypestiny join alltypessmall using (id)
---- RESULTS
====
---- QUERY
# Negative test for illegal row filter that references a non-existing column 'test_id',
# which results in AnalysisException.
select * from functional_parquet.alltypes limit 10
---- CATCH
AnalysisException: Could not resolve column/field reference: 'test_id'
====
---- QUERY
# Negative test for illegal row filter "100 id = int_col" which has syntax error.
select * from functional_parquet.alltypessmall limit 10
---- CATCH
ParseException: Syntax error in line 1
====
---- QUERY
# Row-filtering policy on 'functional_parquet.alltypes' references a nonexisting column
# 'test_id' which exists in 'functional.jointbl'. But it won't be resolved as corelated
# reference and will still hit AnalysisException.
select * from functional.jointbl
where exists(select * from functional_parquet.alltypes);
---- CATCH
AnalysisException: Could not resolve column/field reference: 'test_id'
====
---- QUERY
# Row-filtering policy on 'functional_parquet.alltypes' references a nonexisting column
# 'test_id' which exists in 'functional.jointbl'. But it won't be resolved as corelated
# reference and will still hit AnalysisException.
select * from functional.jointbl, functional_parquet.alltypes limit 10
---- CATCH
AnalysisException: Could not resolve column/field reference: 'test_id'
====
---- QUERY
# Row-filtering policy on the view keeps rows with "id < 5". Row-filtering policy on the
# underlying table 'alltypes' keeps rows with "year = 2009 and month = 1".
select id, bool_col, int_col, string_col, date_string_col, year, month
from functional.alltypes_view where id % 2 = 0
---- RESULTS
0,true,0,'0','01/01/09',2009,1
2,true,2,'2','01/01/09',2009,1
4,true,4,'4','01/01/09',2009,1
---- TYPES
INT,BOOLEAN,INT,STRING,STRING,INT,INT
====
---- QUERY
# Test on star select item
# Row-filtering policy on the view keeps rows with "id < 5". Row-filtering policy on the
# underlying table 'alltypes' keeps rows with "year = 2009 and month = 1".
select * from functional.alltypes_view
---- RESULTS
0,true,0,0,0,0,0.0,0.0,'01/01/09','0',2009-01-01 00:00:00,2009,1
1,false,1,1,1,10,1.10000002384,10.1,'01/01/09','1',2009-01-01 00:01:00,2009,1
2,true,2,2,2,20,2.20000004768,20.2,'01/01/09','2',2009-01-01 00:02:00.100000000,2009,1
3,false,3,3,3,30,3.29999995232,30.3,'01/01/09','3',2009-01-01 00:03:00.300000000,2009,1
4,true,4,4,4,40,4.40000009537,40.4,'01/01/09','4',2009-01-01 00:04:00.600000000,2009,1
---- TYPES
INT,BOOLEAN,TINYINT,SMALLINT,INT,BIGINT,FLOAT,DOUBLE,STRING,STRING,TIMESTAMP,INT,INT
====
---- QUERY
# Test on star select item with normal columns
select int_col, * from functional.alltypes_view
---- RESULTS
0,0,true,0,0,0,0,0.0,0.0,'01/01/09','0',2009-01-01 00:00:00,2009,1
1,1,false,1,1,1,10,1.10000002384,10.1,'01/01/09','1',2009-01-01 00:01:00,2009,1
2,2,true,2,2,2,20,2.20000004768,20.2,'01/01/09','2',2009-01-01 00:02:00.100000000,2009,1
3,3,false,3,3,3,30,3.29999995232,30.3,'01/01/09','3',2009-01-01 00:03:00.300000000,2009,1
4,4,true,4,4,4,40,4.40000009537,40.4,'01/01/09','4',2009-01-01 00:04:00.600000000,2009,1
---- TYPES
INT,INT,BOOLEAN,TINYINT,SMALLINT,INT,BIGINT,FLOAT,DOUBLE,STRING,STRING,TIMESTAMP,INT,INT
====
---- QUERY
# Test on star select item with normal columns
select string_col, * from functional.alltypes_view
---- RESULTS
'0',0,true,0,0,0,0,0.0,0.0,'01/01/09','0',2009-01-01 00:00:00,2009,1
'1',1,false,1,1,1,10,1.10000002384,10.1,'01/01/09','1',2009-01-01 00:01:00,2009,1
'2',2,true,2,2,2,20,2.20000004768,20.2,'01/01/09','2',2009-01-01 00:02:00.100000000,2009,1
'3',3,false,3,3,3,30,3.29999995232,30.3,'01/01/09','3',2009-01-01 00:03:00.300000000,2009,1
'4',4,true,4,4,4,40,4.40000009537,40.4,'01/01/09','4',2009-01-01 00:04:00.600000000,2009,1
---- TYPES
STRING,INT,BOOLEAN,TINYINT,SMALLINT,INT,BIGINT,FLOAT,DOUBLE,STRING,STRING,TIMESTAMP,INT,INT
====
---- QUERY
# Test on star select item with normal columns
select string_col, *, int_col from functional.alltypes_view
---- RESULTS
'0',0,true,0,0,0,0,0.0,0.0,'01/01/09','0',2009-01-01 00:00:00,2009,1,0
'1',1,false,1,1,1,10,1.10000002384,10.1,'01/01/09','1',2009-01-01 00:01:00,2009,1,1
'2',2,true,2,2,2,20,2.20000004768,20.2,'01/01/09','2',2009-01-01 00:02:00.100000000,2009,1,2
'3',3,false,3,3,3,30,3.29999995232,30.3,'01/01/09','3',2009-01-01 00:03:00.300000000,2009,1,3
'4',4,true,4,4,4,40,4.40000009537,40.4,'01/01/09','4',2009-01-01 00:04:00.600000000,2009,1,4
---- TYPES
STRING,INT,BOOLEAN,TINYINT,SMALLINT,INT,BIGINT,FLOAT,DOUBLE,STRING,STRING,TIMESTAMP,INT,INT,INT
====
---- QUERY
# The query has no results since the where-clause is the opposite of the row-filter expr.
select * from functional.alltypes_view where id >= 5
---- RESULTS
---- TYPES
INT,BOOLEAN,TINYINT,SMALLINT,INT,BIGINT,FLOAT,DOUBLE,STRING,STRING,TIMESTAMP,INT,INT
====
---- QUERY
# Test local view using views. Row filter "id < 5" is applied on alltypes_view. Row filter
# "year = 2009 and month = 1" is applied on alltypes inside alltypes_view.
with v as (
  select id, bool_col, int_col, string_col, date_string_col, year, month
  from functional.alltypes_view where id % 2 = 0
) select * from v where id != 0
---- RESULTS
2,true,2,'2','01/01/09',2009,1
4,true,4,'4','01/01/09',2009,1
---- TYPES
INT,BOOLEAN,INT,STRING,STRING,INT,INT
====
---- QUERY
# Test on WITH clause and views. functional.alltypestiny has row filter "id % 2 = 0".
# functional.alltypessmall has row filter
# "(string_col = '0' and id <= 0) or (string_col = '1' and bool_col = true and id > 90)".
# functional.alltypes_view has row filter "id < 5".
# functional.alltypes used in alltypes_view has row filter "year = 2009 and month = 1".
with v1 as (select id, bool_col, string_col from functional.alltypestiny),
     v2 as (select id, bool_col, string_col from functional.alltypessmall)
select v.id, v.bool_col, v.string_col from v1, v2, functional.alltypes_view v
where v1.id = v2.id and v2.id = v.id
---- RESULTS
0,true,'0'
---- TYPES
INT,BOOLEAN,STRING
====
---- QUERY
# Test on CTAS
create table $UNIQUE_DB.masked_tbl as select * from functional.alltypestiny;
select * from $UNIQUE_DB.masked_tbl;
---- RESULTS
0,true,0,0,0,0,0,0,'01/01/09','0',2009-01-01 00:00:00,2009,1
2,true,0,0,0,0,0,0,'02/01/09','0',2009-02-01 00:00:00,2009,2
4,true,0,0,0,0,0,0,'03/01/09','0',2009-03-01 00:00:00,2009,3
6,true,0,0,0,0,0,0,'04/01/09','0',2009-04-01 00:00:00,2009,4
---- TYPES
INT,BOOLEAN,TINYINT,SMALLINT,INT,BIGINT,FLOAT,DOUBLE,STRING,STRING,TIMESTAMP,INT,INT
====
---- QUERY
# Test UPDATE stmt
create table $UNIQUE_DB.masked_kudu_tbl(id int primary key, string_col string) stored as kudu;
insert into $UNIQUE_DB.masked_kudu_tbl select id, string_col from functional.alltypestiny;
insert into $UNIQUE_DB.masked_kudu_tbl values (1, NULL), (3, NULL), (5, NULL);
update k set k.string_col=a.string_col
from $UNIQUE_DB.masked_kudu_tbl k JOIN functional.alltypestiny a ON (k.id=a.id);
select * from $UNIQUE_DB.masked_kudu_tbl;
---- RESULTS
0,'0'
1,'NULL'
2,'0'
3,'NULL'
4,'0'
5,'NULL'
6,'0'
---- TYPES
INT, STRING
====
---- QUERY
# Test on SELECT used in INSERT statement
create table $UNIQUE_DB.masked_tbl2 like functional.alltypestiny stored as textfile;
insert into $UNIQUE_DB.masked_tbl2 partition(year, month) select * from functional.alltypestiny;
select * from $UNIQUE_DB.masked_tbl2;
---- RESULTS
0,true,0,0,0,0,0,0,'01/01/09','0',2009-01-01 00:00:00,2009,1
2,true,0,0,0,0,0,0,'02/01/09','0',2009-02-01 00:00:00,2009,2
4,true,0,0,0,0,0,0,'03/01/09','0',2009-03-01 00:00:00,2009,3
6,true,0,0,0,0,0,0,'04/01/09','0',2009-04-01 00:00:00,2009,4
---- TYPES
INT,BOOLEAN,TINYINT,SMALLINT,INT,BIGINT,FLOAT,DOUBLE,STRING,STRING,TIMESTAMP,INT,INT
====
---- QUERY
# Test on INSERT with local view
create table $UNIQUE_DB.masked_tbl3 like functional.alltypestiny stored as textfile;
with v as (select * from functional.alltypestiny where id < 4)
insert into $UNIQUE_DB.masked_tbl3 partition(year, month) select * from v;
select * from $UNIQUE_DB.masked_tbl3;
---- RESULTS
0,true,0,0,0,0,0,0,'01/01/09','0',2009-01-01 00:00:00,2009,1
2,true,0,0,0,0,0,0,'02/01/09','0',2009-02-01 00:00:00,2009,2
---- TYPES
INT,BOOLEAN,TINYINT,SMALLINT,INT,BIGINT,FLOAT,DOUBLE,STRING,STRING,TIMESTAMP,INT,INT
====
---- QUERY
# Test on CreateView. Should not add row filters when used in sql generations.
create view $UNIQUE_DB.masked_view as select * from functional.alltypestiny;
show create view $UNIQUE_DB.masked_view;
---- RESULTS
'CREATE VIEW $UNIQUE_DB.masked_view AS\nSELECT * FROM functional.alltypestiny'
====
---- QUERY
# The row filter on underlying table 'functional.alltypestiny' still take place.
select * from $UNIQUE_DB.masked_view
---- RESULTS
0,true,0,0,0,0,0,0,'01/01/09','0',2009-01-01 00:00:00,2009,1
2,true,0,0,0,0,0,0,'02/01/09','0',2009-02-01 00:00:00,2009,2
4,true,0,0,0,0,0,0,'03/01/09','0',2009-03-01 00:00:00,2009,3
6,true,0,0,0,0,0,0,'04/01/09','0',2009-04-01 00:00:00,2009,4
---- TYPES
INT,BOOLEAN,TINYINT,SMALLINT,INT,BIGINT,FLOAT,DOUBLE,STRING,STRING,TIMESTAMP,INT,INT
====
---- QUERY
# Test on AlterView. Should not add row filters when used in sql generations.
alter view $UNIQUE_DB.masked_view as select id from functional.alltypestiny;
show create view $UNIQUE_DB.masked_view;
---- RESULTS
'CREATE VIEW $UNIQUE_DB.masked_view AS\nSELECT id FROM functional.alltypestiny'
====
---- QUERY
# The row filter on underlying table 'functional.alltypestiny' still take place.
select * from $UNIQUE_DB.masked_view
---- RESULTS
0
2
4
6
---- TYPES
INT
====
---- QUERY
# Test subquery row filter "id = (select min(id) from functional.alltypesagg)".
# The row filter won't be recursively applied in the subquery.
select id, bool_col, string_col from functional.alltypesagg
---- RESULTS
0,true,'0'
0,true,'0'
---- TYPES
INT,BOOLEAN,STRING
====
---- QUERY
# Test subquery row filter "id = (select min(id) from functional.alltypesagg)".
# The row filter won't be recursively applied in the subquery.
select count(*) from functional.alltypesagg
---- RESULTS
2
---- TYPES
BIGINT
====
---- QUERY
# Test subquery row filter "id in (select id from functional.alltypestiny)".
# Row filter (id % 2 = 0) of functional.alltypestiny won't be recursively applied.
# This is consistent with Hive.
select id, bool_col, string_col from functional_parquet.alltypesagg
---- RESULTS
0,true,'0'
0,true,'0'
1,false,'1'
2,true,'2'
3,false,'3'
4,true,'4'
5,false,'5'
6,true,'6'
7,false,'7'
---- TYPES
INT,BOOLEAN,STRING
====
---- QUERY
# Test subquery row filter "id in (select id from functional.alltypestiny)".
# Row filter (id % 2 = 0) of functional.alltypestiny won't be recursively applied.
# This is consistent with Hive.
select count(*) from functional_parquet.alltypesagg
---- RESULTS
9
---- TYPES
BIGINT
====
---- QUERY
# Test subquery row filter "id in (select id from functional.alltypestiny)".
# Row filter (id % 2 = 0) of functional.alltypestiny will be applied on t. It won't be
# recursively applied in the row filter of functional_parquet.alltypesagg.
select t.id, t.bool_col, t.string_col
from functional.alltypestiny t join functional_parquet.alltypesagg a on t.id = a.id
---- RESULTS
0,true,'0'
0,true,'0'
2,true,'0'
4,true,'0'
6,true,'0'
---- TYPES
INT,BOOLEAN,STRING
====
---- QUERY
# Same as the above query but adding a WHERE clause
select t.id, t.bool_col, t.string_col
from functional.alltypestiny t join functional_parquet.alltypesagg a on t.id = a.id
where t.id != 0 and a.id < 3
---- RESULTS
2,true,'0'
---- TYPES
INT,BOOLEAN,STRING
====
---- QUERY
# Test subquery row filter "id in (select id from functional.alltypestiny)".
# Row filter (id % 2 = 0) of functional.alltypestiny will be applied on t. It won't be
# recursively applied in the row filter of functional_parquet.alltypesagg.
select a.id, a.bool_col, a.string_col, t.id, t.bool_col, t.string_col
from functional_parquet.alltypesagg a left join functional.alltypestiny t on t.id = a.id
---- RESULTS
0,true,'0',0,true,'0'
0,true,'0',0,true,'0'
1,false,'1',NULL,NULL,'NULL'
2,true,'2',2,true,'0'
3,false,'3',NULL,NULL,'NULL'
4,true,'4',4,true,'0'
5,false,'5',NULL,NULL,'NULL'
6,true,'6',6,true,'0'
7,false,'7',NULL,NULL,'NULL'
---- TYPES
INT,BOOLEAN,STRING,INT,BOOLEAN,STRING
====
---- QUERY
# Test subquery row filter "id in (select id from functional.alltypestiny)" in local
# views.
with v1 as (select id, bool_col, string_col from functional_parquet.alltypesagg),
  v2 as (select id, count(*) cnt from functional_parquet.alltypesagg group by id)
select count(*) from v1 join v2 on v1.id = v2.id
---- RESULTS
9
---- TYPES
BIGINT
====
---- QUERY
# Row-filtering policy keeps rows with "nested_struct.a is not NULL"
select id, nested_struct.* from functional_parquet.complextypestbl
---- RESULTS
1,1
7,7
8,-1
---- TYPES
BIGINT,INT
====
---- QUERY
# Row-filtering policy keeps rows with "nested_struct.a is not NULL"
select id, nested_struct.a, arr.item
from functional_parquet.complextypestbl t, t.nested_struct.b arr
---- RESULTS
1,1,1
7,7,2
7,7,3
7,7,NULL
8,-1,-1
---- TYPES
BIGINT,INT,INT
====
---- QUERY
# Row-filtering policy keeps rows with "nested_struct.a is not NULL"
select id, b.item from functional_parquet.complextypestbl t, t.nested_struct.b
---- RESULTS
1,1
7,2
7,3
7,NULL
8,-1
---- TYPES
BIGINT,INT
====
---- IS_HDFS_ONLY
---- QUERY
select * from functional_parquet.iceberg_v2_positional_not_all_data_files_have_delete_files;
---- RESULTS
1,'a'
3,'c'
5,'X'
---- TYPES
INT,STRING
====
---- QUERY
# TODO: Row-filtering policy should keep rows with "nested_struct.a is not NULL" on base
# table 'complextypestbl'. But now we can't apply it since the collection column 'b' is
# non-relative. Fails these queries until IMPALA-10484 is resolved. See the next query
# for desired results.
select * from functional_parquet.complextypestbl.nested_struct.b
---- CATCH
AnalysisException: Using non-relative collection column nested_struct.b of table
 functional_parquet.complextypestbl is not supported since there are row-filtering
 policies on this table (IMPALA-10484). Rewrite query to use relative reference.
====
---- QUERY
# The above query should be manually rewritten to this until IMPALA-10484 is resolved.
select b.item from functional_parquet.complextypestbl t, t.nested_struct.b
---- RESULTS
1
2
3
NULL
-1
---- TYPES
INT
====
---- QUERY
# IMPALA-10554: Updates on masked tables should be blocked.
insert into functional.alltypestiny partition(year, month) select * from functional.alltypes
---- CATCH
AuthorizationException: User '$USER' does not have privileges to execute 'INSERT' on: functional.alltypestiny
====
---- QUERY
# IMPALA-10554: Updates on masked tables should be blocked.
truncate table functional.alltypestiny
---- CATCH
AuthorizationException: User '$USER' does not have privileges to execute 'INSERT' on: functional.alltypestiny
====
---- QUERY
# IMPALA-10554: Updates on masked tables should be blocked.
compute stats functional.alltypestiny
---- CATCH
AuthorizationException: User '$USER' does not have privileges to execute 'ALTER' on: functional.alltypestiny
====
---- QUERY
# Deletes should be blocked if the user cannot see all the rows from the table.
delete from functional_parquet.iceberg_v2_positional_not_all_data_files_have_delete_files where i = 2;
---- CATCH
AuthorizationException: User '$USER' does not have privileges to access: functional_parquet.iceberg_v2_positional_not_all_data_files_have_delete_files
====
---- QUERY
# Updates on masked tables should be blocked.
update functional_parquet.iceberg_v2_positional_not_all_data_files_have_delete_files set s = concat(s, 'a');
---- CATCH
AuthorizationException: User '$USER' does not have privileges to access: functional_parquet.iceberg_v2_positional_not_all_data_files_have_delete_files
====
